{
  "schema_version": "1.0",
  "triage_id": "triage_449d7a27832b",
  "context_id": "ctx_28dc5b0d93d7",
  "subject_id": "demo_dog_01",
  "created_at": "2026-09-26T16:25:44.606Z",
  "model": "mock",
  "decision": "routine",
  "confidence": 0.5,
  "evidence_event_ids": [
    "evt_001"
  ],
  "referenced_alert_ids": [],
  "owner_message": "Nothing notable in the last minute.",
  "uncertainty": "Mock triage (no ANTHROPIC_API_KEY set): a fixed rule-of-thumb summary of the active alerts and recent events, not a model read of the context.",
  "suggested_check": "Look in on your dog if you're nearby."
}